{
  "schema_version": 1,
  "modifier_id": "modifier:concept-modifier-workflow:sha256:4040404040404040404040404040404040404040404040404040404040404040",
  "logical_key": "head_detail",
  "component_key": "H",
  "content_sha256": "sha256:4040404040404040404040404040404040404040404040404040404040404040",
  "forge_manifest_sha256": "sha256:4545454545454545454545454545454545454545454545454545454545454545",
  "descriptor_sha256": "sha256:4646464646464646464646464646464646464646464646464646464646464646",
  "media_type": "image/png",
  "provenance_sha256": "sha256:4242424242424242424242424242424242424242424242424242424242424242",
  "license_id": "owned-original",
  "authorized_lineage_ids": ["concept-modifier-workflow"],
  "source_artifacts": ["sha256:6060606060606060606060606060606060606060606060606060606060606060"],
  "extraction_report_sha256": "sha256:4343434343434343434343434343434343434343434343434343434343434343",
  "video_report_sha256": null,
  "created_by_operation_sha256": "sha256:4444444444444444444444444444444444444444444444444444444444444444",
  "raster_overhang_px": 4,
  "verification": {
    "alpha_matte": "transparent_rgba_verified",
    "background_contamination": "pass",
    "edge_fringes": "pass",
    "outer_frame_edge": "pass_transparent_effect",
    "frame_gutters": "pass",
    "immutable_bytes": true
  }
}
