{
  "schema_version": 1,
  "modifier_id": "modifier:concept_replace_me:sha256:bbbbbbbbbbbbbbbbbbbbbbbbbbbbbbbbbbbbbbbbbbbbbbbbbbbbbbbbbbbbbbbb",
  "logical_key": "head_detail",
  "component_key": "H",
  "content_sha256": "sha256:bbbbbbbbbbbbbbbbbbbbbbbbbbbbbbbbbbbbbbbbbbbbbbbbbbbbbbbbbbbbbbbb",
  "forge_manifest_sha256": "sha256:cccccccccccccccccccccccccccccccccccccccccccccccccccccccccccccccc",
  "descriptor_sha256": "sha256:dddddddddddddddddddddddddddddddddddddddddddddddddddddddddddddddd",
  "media_type": "image/png",
  "provenance_sha256": "sha256:eeeeeeeeeeeeeeeeeeeeeeeeeeeeeeeeeeeeeeeeeeeeeeeeeeeeeeeeeeeeeeee",
  "license_id": "owned-original",
  "authorized_lineage_ids": ["concept_replace_me"],
  "source_artifacts": [
    "sha256:ffffffffffffffffffffffffffffffffffffffffffffffffffffffffffffffff"
  ],
  "extraction_report_sha256": "sha256:1111111111111111111111111111111111111111111111111111111111111111",
  "video_report_sha256": null,
  "created_by_operation_sha256": "sha256:2222222222222222222222222222222222222222222222222222222222222222",
  "raster_overhang_px": 4,
  "verification": {
    "alpha_matte": "transparent_rgba_verified",
    "background_contamination": "pass",
    "edge_fringes": "pass",
    "outer_frame_edge": "pass_transparent_effect",
    "frame_gutters": "pass",
    "immutable_bytes": true
  }
}
