{
  "schema_version": 1,
  "modifier_id": "modifier:concept-modifier-workflow:sha256:3030303030303030303030303030303030303030303030303030303030303030",
  "logical_key": "body_transition",
  "component_key": "B1",
  "content_sha256": "sha256:3030303030303030303030303030303030303030303030303030303030303030",
  "forge_manifest_sha256": "sha256:3939393939393939393939393939393939393939393939393939393939393939",
  "descriptor_sha256": "sha256:3a3a3a3a3a3a3a3a3a3a3a3a3a3a3a3a3a3a3a3a3a3a3a3a3a3a3a3a3a3a3a3a",
  "media_type": "image/png",
  "provenance_sha256": "sha256:3232323232323232323232323232323232323232323232323232323232323232",
  "license_id": "owned-original",
  "authorized_lineage_ids": ["concept-modifier-workflow"],
  "source_artifacts": [
    "sha256:3333333333333333333333333333333333333333333333333333333333333333",
    "sha256:3434343434343434343434343434343434343434343434343434343434343434",
    "sha256:3535353535353535353535353535353535353535353535353535353535353535"
  ],
  "extraction_report_sha256": "sha256:3636363636363636363636363636363636363636363636363636363636363636",
  "video_report_sha256": "sha256:3737373737373737373737373737373737373737373737373737373737373737",
  "created_by_operation_sha256": "sha256:3838383838383838383838383838383838383838383838383838383838383838",
  "raster_overhang_px": 4,
  "verification": {
    "alpha_matte": "exact_mask_matte_verified",
    "background_contamination": "pass",
    "edge_fringes": "pass",
    "outer_frame_edge": "pass_transparent_effect",
    "frame_gutters": "pass",
    "immutable_bytes": true
  }
}
